{
  "schema_version": 3,
  "concept": "A capability tier is declared once on an agent source and resolved here to a concrete model per vendor, then to each surface's own spelling of it — because availability, id spelling and cost all vary by surface. tier_order is cheapest first. Read tiers.<tier>.vendors.<vendor>.surfaces.<surface>: when status is 'available' its 'model' is the value that surface's model field accepts, with that surface's own published cost and limits beside it; when status is 'unavailable' there is deliberately NO model key, because substituting another tier's model would be a silent demotion. A 'collapse' entry means the vendor ships a shorter ladder and two tiers intentionally resolve to one model. When a spawn pins no vendor, walk tiers.<tier>.vendor_order in order and take the first vendor whose cell for your surface is available; it lists every vendor exactly once. A tier with no available vendor on a surface resolves to nothing — never to a neighbouring tier. Plain JSON on purpose: any harness can consume this file without the tool that generated it.",
  "generated_by": ".scripts/generate_model_map.py",
  "tier_order": [
    "low",
    "medium",
    "high",
    "maximum"
  ],
  "general_model_rule": {
    "require_text_input": true,
    "require_text_only_output": true,
    "require_tool_call": true
  },
  "vendors": {
    "anthropic": {
      "name": "Anthropic",
      "surfaces": [
        "anthropic",
        "github-copilot"
      ]
    },
    "openai": {
      "name": "OpenAI",
      "surfaces": [
        "openai",
        "github-copilot"
      ]
    },
    "moonshotai": {
      "name": "Moonshot AI",
      "surfaces": [
        "moonshotai",
        "github-copilot"
      ]
    },
    "google": {
      "name": "Google",
      "surfaces": [
        "google",
        "github-copilot"
      ]
    }
  },
  "surfaces": {
    "anthropic": {
      "consumed_by": "Claude Code agent frontmatter and the Anthropic API",
      "accepts": "hyphenated Anthropic model id",
      "verified": "Claude Code frontmatter takes this id or a short alias such as `haiku`"
    },
    "openai": {
      "consumed_by": "the OpenAI API",
      "accepts": "models.dev serving id for this provider",
      "verified": "not exercised here — models.dev's published serving id, taken on trust"
    },
    "moonshotai": {
      "consumed_by": "the Moonshot API",
      "accepts": "models.dev serving id for this provider",
      "verified": "not exercised here — models.dev's published serving id, taken on trust"
    },
    "google": {
      "consumed_by": "the Gemini API",
      "accepts": "models.dev serving id for this provider",
      "verified": "not exercised here — models.dev's published serving id, taken on trust"
    },
    "github-copilot": {
      "consumed_by": "GitHub Copilot and VS Code custom-agent frontmatter",
      "accepts": "dotted models.dev serving id (the display name is a second accepted alias)",
      "verified": "exercised against copilot CLI 1.0.75 — the dotted id and the display name are both accepted and the hyphenated Anthropic form is rejected"
    }
  },
  "provenance": {
    "source_url": "https://models.dev/api.json",
    "fetched_date": "2026-09-12",
    "payload_sha256": "07617fe08e8038b5fa2d5018dfe896a7478d6f48f2e78af2bc308d32914c5560",
    "payload_bytes": 4621537,
    "etag": "\"07617fe08e8038b5fa2d5018dfe896a7\"",
    "note": "models.dev serves api.json as a CDN-cached generated artifact and publishes no git commit sha: the payload has no commit field and the response has no last-modified header. payload_sha256 plus etag is therefore the strongest available upstream identity, and no commit-sha field is claimed. Per-surface upstream_last_updated is models.dev's record date."
  },
  "tiers": {
    "low": {
      "vendor_order": [
        "anthropic",
        "openai",
        "google",
        "moonshotai"
      ],
      "vendors": {
        "anthropic": {
          "anchor": "claude-haiku-4-5",
          "model_name": "Claude Haiku 4.5 (latest)",
          "family": "claude-haiku",
          "reasoning": true,
          "surfaces": {
            "anthropic": {
              "status": "available",
              "model": "claude-haiku-4-5",
              "cost_usd_per_mtok": {
                "input": 1,
                "output": 5
              },
              "limit_tokens": {
                "context": 200000,
                "output": 64000
              },
              "upstream_last_updated": "2025-10-15"
            },
            "github-copilot": {
              "status": "available",
              "model": "claude-haiku-4.5",
              "cost_usd_per_mtok": {
                "input": 1,
                "output": 5
              },
              "limit_tokens": {
                "context": 200000,
                "input": 136000,
                "output": 64000
              },
              "upstream_last_updated": "2025-10-15"
            }
          }
        },
        "openai": {
          "anchor": "gpt-5.6-luna",
          "model_name": "GPT-5.6 Luna",
          "family": "gpt-luna",
          "reasoning": true,
          "surfaces": {
            "openai": {
              "status": "available",
              "model": "gpt-5.6-luna",
              "cost_usd_per_mtok": {
                "input": 0.2,
                "output": 1.2
              },
              "limit_tokens": {
                "context": 1050000,
                "input": 922000,
                "output": 128000
              },
              "upstream_last_updated": "2026-07-09"
            },
            "github-copilot": {
              "status": "available",
              "model": "gpt-5.6-luna",
              "cost_usd_per_mtok": {
                "input": 0.2,
                "output": 1.2
              },
              "limit_tokens": {
                "context": 1050000,
                "input": 922000,
                "output": 128000
              },
              "upstream_last_updated": "2026-07-09"
            }
          }
        },
        "moonshotai": {
          "anchor": "kimi-k2.6",
          "model_name": "Kimi K2.6",
          "family": "kimi-k2",
          "reasoning": true,
          "surfaces": {
            "moonshotai": {
              "status": "available",
              "model": "kimi-k2.6",
              "cost_usd_per_mtok": {
                "input": 0.95,
                "output": 4
              },
              "limit_tokens": {
                "context": 262144,
                "output": 262144
              },
              "upstream_last_updated": "2026-04-21"
            },
            "github-copilot": {
              "status": "unavailable",
              "reason": "provider 'github-copilot' serves no model named 'Kimi K2.6'"
            }
          }
        },
        "google": {
          "anchor": "gemini-3.1-flash-lite",
          "model_name": "Gemini 3.1 Flash Lite",
          "family": "gemini-flash-lite",
          "reasoning": true,
          "surfaces": {
            "google": {
              "status": "available",
              "model": "gemini-3.1-flash-lite",
              "cost_usd_per_mtok": {
                "input": 0.25,
                "output": 1.5
              },
              "limit_tokens": {
                "context": 1048576,
                "output": 65536
              },
              "upstream_last_updated": "2026-05-07"
            },
            "github-copilot": {
              "status": "unavailable",
              "reason": "provider 'github-copilot' serves no model named 'Gemini 3.1 Flash Lite'"
            }
          }
        }
      }
    },
    "medium": {
      "vendor_order": [
        "anthropic",
        "openai",
        "google",
        "moonshotai"
      ],
      "vendors": {
        "anthropic": {
          "anchor": "claude-sonnet-5",
          "model_name": "Claude Sonnet 5",
          "family": "claude-sonnet",
          "reasoning": true,
          "surfaces": {
            "anthropic": {
              "status": "available",
              "model": "claude-sonnet-5",
              "cost_usd_per_mtok": {
                "input": 2,
                "output": 10
              },
              "limit_tokens": {
                "context": 1000000,
                "output": 128000
              },
              "upstream_last_updated": "2026-06-30"
            },
            "github-copilot": {
              "status": "available",
              "model": "claude-sonnet-5",
              "cost_usd_per_mtok": {
                "input": 2,
                "output": 10
              },
              "limit_tokens": {
                "context": 1000000,
                "output": 128000
              },
              "upstream_last_updated": "2026-06-30"
            }
          }
        },
        "openai": {
          "anchor": "gpt-5.6-terra",
          "model_name": "GPT-5.6 Terra",
          "family": "gpt-terra",
          "reasoning": true,
          "surfaces": {
            "openai": {
              "status": "available",
              "model": "gpt-5.6-terra",
              "cost_usd_per_mtok": {
                "input": 2,
                "output": 12
              },
              "limit_tokens": {
                "context": 1050000,
                "input": 922000,
                "output": 128000
              },
              "upstream_last_updated": "2026-07-09"
            },
            "github-copilot": {
              "status": "available",
              "model": "gpt-5.6-terra",
              "cost_usd_per_mtok": {
                "input": 2,
                "output": 12
              },
              "limit_tokens": {
                "context": 1050000,
                "input": 922000,
                "output": 128000
              },
              "upstream_last_updated": "2026-07-09"
            }
          }
        },
        "moonshotai": {
          "anchor": "kimi-k2.7-code",